{
  "PK": "JOB#66666666-6666-4666-8666-666666666666",
  "SK": "META",
  "entityType": "FanOutJob",
  "jobId": "66666666-6666-4666-8666-666666666666",
  "publishId": "66666666-6666-4666-8666-666666666666",
  "templateId": "33333333-3333-4333-8333-333333333333",
  "targetVersion": "v7",
  "priority": "PUBLISH",
  "expected": 200,
  "done": 150,
  "failed": 2,
  "obsolete": 0,
  "cancelRequested": false,
  "version": 153,
  "createdBy": "00000000-0000-4000-8000-000000000001",
  "createdAt": "2026-10-22T10:00:00Z",
  "updatedBy": "00000000-0000-4000-8000-000000000001",
  "updatedAt": "2026-10-22T10:00:05Z",
  "state": "RUNNING"
}
